character,dialogue
Tony,할 거야. GSG-9가 국경을 지키고 있어. 정찰기가 24/7 날고 있어. 그들이 발견할 거야. 우리가 처리할게.
Tony,"존경을 담아 말하지만, 총알을 든 소년들로는 이 문제를 해결할 수 없을 거예요, 로스. 우리가 그들을 데려오게 해주세요."
Tony,"왜냐하면 이번엔 내가 로퍼와 실크 셔츠를 입고 있지 않을 거니까. 72시간 안에, 보장할게요."
Tony,"감사합니다, 선생님. 내 왼팔이 저려, 이게 정상인가요?"
Tony,"항상 그래. 36시간이라, 세상에."
Tony,"오, 그래. 지금 헐크가 있으면 정말 좋을 텐데. 가능성 있어?"
Tony,아니.
Tony,나도 그래. 네 건 어디 있어?
Tony,"오, 파커 군."
Tony,토니.
Tony,드디어 만나게 됐군. 내 이메일 받았지?
Tony,그렇지?
Tony,9월 재단.
Tony,그래. 지원했던 거 기억나?
Tony,"내가 승인했어, 그래서 이제 우리는 협력 관계야."
Tony,그걸 정리하러 왔어.
Tony,그녀가 누군가의 숙모라니 믿기 힘들군.
Tony,이 호두 대추 빵이 정말 맛있네요.
Tony,그래?
Tony,그래.
Tony,꽤 잘 지원받고 있지.
Tony,누구한테 말하는지 알지? 5분만 그와 이야기할 수 있을까?
Tony,"호두 대추 빵 치고는 나쁘지 않았어. 와, 이게 뭐지? 레트로 기술이네, 응? 중고 상점? 구세군?"
Tony,넌 쓰레기통 다이버구나.
Tony,아-아! 내가 먼저.
Tony,"수사적인 질문 하나 할게. 이게 너지, 맞지?"
Tony,"그래. 봐봐, 대단하네. 와! 멋진 캐치야. 3,000파운드, 시속 40마일. 쉽지 않아. 미친 실력이군."
Tony,음-흠.
Tony,"그래, 그래, 그래, 그래... 오, 피닉스 상공의 UFO 같은 거 말이야?"
Tony,"오, 이건 뭐지?"
Tony,그래서. 넌... 스파이더... 링. 범죄와 싸우는 스파이더... 넌 스파이더보이?
Tony,그 옷을 입고는 아니지.
Tony,누가 또 알아? 누구?
Tony,네 특이하게 매력적인... 숙모도 모르고?
Tony,내가 정말 멋지다고 생각하는 게 뭔지 알아? 이 웹이야. 이 인장 강도는 차트를 벗어났어. 누가 만들었어?
Tony,벽을 기어오르는 건 어떻게 하는 거야? 접착 장갑?
Tony,세상에! 이걸 쓰고 볼 수나 있어?
Tony,"넌 절실하게 업그레이드가 필요해. 체계적으로, 위에서 아래까지. 100점 만점의 복원. 그래서 내가 여기 온 거야. 왜 이러는 거야? 알아야겠어. 네 동기가 뭐야? 아침에 2층 침대에서 일어나게 만드는 게 뭐야?"
Tony,음-흠.
Tony,"그래, 넌 다르니까."
Tony,"그래서 넌 작은 사람들을 돌보고 싶어? 네 몫을 하고 싶어? 세상을 더 나은 곳으로 만들고, 그런 거 다, 맞지?"
Tony,"난 여기 앉을 거니까, 네 다리를 옮겨. 여권 있어?"
Tony,독일에 가본 적 있어?
Tony,"오, 넌 좋아할 거야."
Tony,왜?
Tony,그 말은 안 한 걸로 할게.
Tony,좀 위험할 수도 있어. 섹시한 숙모한테 내가 널 현장 학습 데려간다고 말해.
Tony,"좋아, 스파이더맨. 날 여기서 꺼내줘."
Tony,"와, 공항에서 사람들을 우연히 만나다니 정말 이상하지 않아? 넌 이상하다고 생각하지 않아?"
Tony,"어쨌든, 로스가 널 데려오라고 36시간을 줬어. 그게 24시간 전이었지. 형제 좀 도와줄 수 있어?"
Tony,네 판단력이 흐려졌어. 네 옛 전우가 어제 무고한 사람들을 죽였어.
Tony,"좋아, 인내심이 바닥났어. 언더루스! 잘했어, 꼬마."
Tony,"그래, 우리가 대화를 시작할 필요는 없어."
Tony,"그래, 나중에 얘기하자. 그냥..."
Tony,...잘했어.
Tony,넌 완전 바보였어. 클린트를 끌어들이고. 완다를 떠나고 싶지도 않은 안전한 곳에서 '구출'하고. 난 지키려고... 네가 어벤저스를 갈라놓는 걸 막으려고 노력하고 있어.
Tony,"좋아, 끝났어. 반스를 넘겨. 우리와 함께 와. 지금 당장! 우리니까! 아니면 무례해도 개의치 않는 J-SOC 부대가... 어서."
Tony,"오, 좋아. 주차장에 둘이 있어. 하나는 맥시모프야, 내가 잡을게. 로디, 캡을 잡을래?"
Tony,우리가 얘기한 대로야. 거리를 유지해. 그들을 웹으로 묶어.
Tony,"완다, 네가 비전의 감정을 상하게 한 것 같아."
Tony,"좋아. 첫째, 그건 과장이야. 둘째, 난 널 보호하려고 그랬어. 안녕, 클린트."
Tony,분명히 은퇴가 너한테 안 맞는 것 같아. 골프 치는 게 지루해졌어?
Tony,모든 일에는 처음이 있지.
Tony,"그래, 나도 그걸 감지했어."
Tony,"글쎄, 내 계획은 그들을 가볍게 다루는 거였어. 바꿔볼래?"
Tony,우리도 마찬가지야.
Tony,프라이데이?
Tony,그들이 뭐라고?
Tony,공유
Tony,내보내기
Tony,다시 쓰기
Tony,"좋아, 우리 편에 충격적이고 환상적인 능력을 숨기고 있는 사람 있어? 제안 받을게."
Tony,"몰라, 탄소 연대 측정은 안 해봤어. 젊은 편이지."
Tony,어쩌면 그 꼬마가 뭔가 알아냈나 봐.
Tony,"꼬마, 괜찮아?"
Tony,"같은 편이야. 누군지 맞춰봐. 안녕, 나야."
Tony,그래.
Tony,그래. 넌 끝났어. 알겠지?
Tony,잘했어. 그대로 있어.
Tony,그대로 있으라고.
Tony,"집에 갈 거야, 아니면 메이 숙모한테 전화할 거야! 끝났다고!"
Tony,로디!
Tony,로디! 생체 신호 읽어.
Tony,어떻게 이런 일이...
Tony,그런 게 가능하다고 생각도 못 했어.
Tony,의사들 말로는 L4에서 S1까지 부서졌대. 척수에 심각한 열상. 아마 어떤 형태로든 마비가 올 거래.
Tony,"넌 그들을 놓아줬어, 나트."
Tony,"우리'? 이중 스파이 습관을 버리기 힘들지, 응? DNA에 박혀있나 봐."
Tony,티찰라가 로스한테 네가 한 일을 말했어. 그러니까... 그들이 널 잡으러 올 거야.
Tony,"프라이데이, 이게 뭐지?"
Tony,헬기 준비해.
Tony,얼굴 인식은 해봤어?
Tony,"음, 모르겠어. 빨간 머리를 상상하고 있었거든."
Tony,그래야겠지.
Tony,"그래서, 진짜 브루사드는 어떻게 됐어?"
Tony,개자식. 이걸 로스한테 보내.
Tony,그래? 파일 구했어? 위성 경로를 바꿔서 이 제모 녀석 얼굴 스캔을 시작하자.
Tony,"제발 좀, 바튼. 여기 넣을 줄 몰랐어. 어서."
Tony,"그래, 하지만 이건 바다 위의 초고도 보안 감옥이잖아. 알잖아, 이곳은 미치광이들을 위한 곳이라고. 이곳은..."
Tony,네가 법을 어겼으니까.
Tony,내가 너보고 그러라고 한 것도 아니잖아.
Tony,"넌 읽었고, 어겼어."
Tony,"좋아, 넌 다 컸고 아내와 아이들도 있잖아. 이해가 안 돼, 왜 잘못된 편을 선택하기 전에 그들을 생각하지 않았어?"
Tony,넌 누구야?
Tony,내일 콜롬비아 메디컬로 이송할 거야. 그러니까... 행운을 빌어. 뭐가 필요해? 밥은 줬어?
Tony,난 그저 스티브가 어디로 갔는지 알아야 하는 사람일 뿐이야.
Tony,"오, 그냥 그들의 'AV'에서 'A'를 날려버렸어. 30초 정도 있으면 그들의 장비가 아니란 걸 알아챌 거야."
Tony,"그냥 봐. 저 사람이 반스를 심문하기로 되어 있었거든. 분명히 내가 실수했어. 샘, 내가 틀렸어."
Tony,캡은 확실히 선을 넘었지만 그가 도움을 받을 수 있을 만큼 받아야 해. 우리는 서로 잘 모르지. 넌 안 해도 돼...
Tony,진정해.
Tony,"아니. 지옥에나 가라고 하더라. 대신 나는 기지로 돌아갈 거야, 하지만 언제든 전화해. 대기시켜 놓을 테니, 난 그 선이 깜빡이는 걸 보는 게 좋거든."
Tony,좀 방어적으로 보이는데.
Tony,"편히 쉬어, 병사. 지금은 널 쫓고 있지 않아."
Tony,네 이야기가 그렇게 미친 게 아닐 수도 있어. 어쩌면. 로스는 내가 여기 있는지 모르고 있어. 그대로 뒀으면 좋겠어. 그렇지 않으면 나 자신을 체포해야 할 테니까.
Tony,"너도 마찬가지야, 캡. 이봐, 만주리안 후보, 날 죽이려고 작정했나 봐. 여긴 휴전 중이야. 내려놓을 수 있어..."
Tony,열 반응 감지됐어.
Tony,"어, 하나."
Tony,내가 그걸 이길 수 있을 거 같은데.
Tony,저 길을 알아. 이게 뭐지?
Tony,알고 있었어?
Tony,"날 속이지 마, 로저스! 알고 있었냐고?"
Tony,비켜!
Tony,"아, 젠장."
Tony,"어서, 어서."
Tony,대충 보고 있어. 넌 그들을 기억이나 해?
Tony,상관없어. 그는 내 엄마를 죽였어.
Tony,그의 싸움 패턴을 분석해.
Tony,그의 엉덩이를 차자.
Tony,나도 그랬어. 그대로 있어. 마지막 경고야.
Tony,그 방패는 네 것이 아니야. 넌 그걸 받을 자격이 없어. 내 아버지가 그 방패를 만들었다고!
Tony,이건 첫 번째 시도일 뿐이야.
Tony,피드백 좀 줘봐. 생각나는 거 뭐든. 충격 흡수. 측면 이동. 컵 홀더?
Tony,가자. 내가 도와줄게.
Tony,괜찮아?
Tony,"그래, 연결해줘."
Tony,"아, 잠깐만 기다려."
Tony,언더루스!
Tony,"뭐하는 거야, 작은 비디오 일기?"
Tony,괜찮아. 나라도 그랬을 거야.
Tony,괜찮아.
Tony,"야, 야, 야, 야, 야. 있잖아? 우리 실제로... 네 숙모를 위한 알리바이 비디오를 만들어야겠어. 준비됐어?"
Tony,촬영 중이야?
Tony,프레임 안으로 들어와.
Tony,"안녕, 메이. 어떻게 지내? 뭘 입고 있어? 섹시한 거 입었길 바라."
Tony,"피터, 그건 부적절해. 좋아, 다시 시작하자. 편집할 수 있을 거야."
Tony,"3, 2, 1. 안녕하세요, 메이. 세상에, 음, 이번 주말 스타크 인턴십 수련회에서 당신의 조카가 얼마나 놀라운 일을 했는지 말씀드리고 싶었어요. 모두가 감명받았죠."
Tony,"이건 네가 퀸즈 대로에 있지 않아서 그래. 봐, 해피는... 자산 관리로 승진하길 바라고 있어. 그는 보안 책임자였고, 그 전엔 그냥 운전사였지."
Tony,"아니, 진지하게, 그가 많이 코 골았어?"
Tony,"해피, 우리 잠깐 시간 좀 줄래?"
Tony,피터의 케이스를 트렁크에서 꺼내줘.
Tony,"그래, 우리 방금 그것에 대해 얘기하고 있었어."
Tony,부탁 하나만 들어줘. 해피가 이 일의 담당자야. 그를 스트레스 받게 하지 마. 바보 같은 짓 하지 마. 난 그의 심전도를 봤거든. 알겠지?
Tony,"내가 할 법한 일은 하지 말고, 절대로 내가 하지 않을 일도 하지 마. 거기에... 거기에 작은 회색 영역이 있어, 그게 네가 활동할 영역이야."
Tony,아니.
Tony,7층.
Tony,"뭐, 다음 임무?"
Tony,우리가 연락할게.
Tony,"아니, 내 말은, 우리가 연락할 거야. 누군가가 널 부를 거라고."
Tony,알겠지?
Tony,알겠어.
Tony,이건 포옹이 아니야. 그냥 문을 잡아주는 거야. 우린 아직 그 정도까진 아니야.
Tony,안녕.
Tony,네 슈트에 모든 걸 넣었어. 이 히터도 포함해서.
Tony,뭘 생각하고 있었던 거야?
Tony,"지금 당장 그를 잡으려고? 진정해, 크로켓, 이런 일을 처리하는 사람들이 있어."
Tony,"아니, 아니, 아니. 이건 그들의 급여 수준보다 좀 낮아."
Tony,"오, 난 여기 없어."
Tony,"여기 와이파이가 있어서 다행이야, 아니면 넌 지금 토스트가 됐을 거야. 가네시에게도 감사해."
Tony,건배.
Tony,"저기, 그 날아다니는 벌처 녀석은 잊어버려, 제발."
Tony,왜? 내가 그렇게 말했으니까!
Tony,"미안, 난 지금 십대랑 얘기하고 있어. 땅에 가까이 붙어 있어. 네 실력을 키워. 너한테 츄로를 사준 그 아줌마처럼 작은 사람들을 도와주면서 말이야. 그냥 친근한..."
Tony,...동네 스파이더맨이 되면 안 돼?
Tony,"아니, 넌 아니야."
Tony,"날 믿어, 꼬마. 캡이 널 제압하고 싶었다면, 벌써 했을 거야. 내 말 들어. 이런 무기들을 또 마주치면, 해피한테 전화해."
Tony,"있잖아, 대학 생각하기엔 절대 이른 법이 없어. 내가 MIT에 좀 끌어줄 수 있거든. 통화 종료."
Tony,파커 군. 잠깐 시간 있어?
Tony,D.C.에서 잘했어.
Tony,내 아버진 날 별로 지지해주지 않으셨어... 그래서 난 그 부끄러움의 고리를 끊으려고 노력 중이야.
Tony,"내가 칭찬하는 중에 말을 자르지 마. 어쨌든, 대단한 일들이 곧-"
Tony,그게 뭐야?
Tony,이상하네. 해피가 6주 전에 밴드를 그만뒀다고 하던데. 무슨 일이야?
Tony,이봐.
Tony,"안녕, 스파이더맨. 밴드 연습이었나?"
Tony,넌 충분히 했다고 생각해.
Tony,이전에 피터가 일을 망친 편: 난 이걸 멀리하라고 했지. 대신 넌 수백만 달러짜리 슈트를 해킹해서 내 뒤에서 몰래 내가 하지 말라고 한 바로 그 일을 했어.
Tony,네 덕분은 아니지.
Tony,"난 들었어, 꼬마야. FBI에 전화한 게 누구라고 생각해? 날 제외하고 모두가 14살 꼬마를 영입하는 건 미친 짓이라고 했다는 걸 알아?"
Tony,"아니, 이제 네가 입 다물 차례야, 알겠어? 어른이 말하고 있어. 오늘 밤 누군가 죽었다면 어쩔 뻔했어? 다른 얘기지, 맞지? 그건 네 책임이야. 그리고 네가 죽었다면, 그건 내 책임이라고 느껴져. 난 그런 죄책감이 필요 없어."
Tony,그래.
Tony,미안하다고 해서 될 일이 아니야.
Tony,"난 네가 더 나아지길 바랐어. 좋아, 이건 잘 안 되고 있어. 슈트를 돌려받아야겠어."
Tony,영원히.
Tony,"그래. 그래, 그게 바로 이런 거야."
Tony,"자, 내놔."
Tony,"이 슈트 없이 넌 아무것도 아니라면, 가질 자격이 없는 거야. 알겠어? 세상에, 내가 아빠처럼 말하고 있네."
Tony,"알겠어, 그건 우리가 해결할게."
Tony,"이 슈트 없이 넌 아무것도 아니라면, 가질 자격이 없는 거야."
Tony,"오, 저기 왔네. 올라오는 길은 어땠어?"
Tony,꼬마랑 잠깐 얘기 좀 할게.
Tony,그래. 꼬마랑 얘기해야 해.
Tony,느슨하게 따라오는 건 어때? 그래? 경계선은 좋은 거야.
Tony,"네 슈트를 가져가서 미안해. 그러니까, 넌 그럴 만했어. 사실, 그게 네가 필요로 했던 완벽한 엄한 사랑의 순간이었던 것 같아, 맞지? 널 자극하기 위해, 맞지? 그렇게 생각하지 않아? 그렇게 생각하지 않아?"
Tony,그랬다고 하자.
Tony,"넌 크게 일을 망쳤어. 정말 크게. 하지만 그 다음엔 옳은 일을 했지. 개를 무료 진료소에 데려가고, 잡종 강아지들을 키웠고... 좋아, 내 비유가 최고는 아니었네. 난 널 오해했어. 조금만 더 멘토링을 받으면, 넌 팀의 진정한 자산이 될 수 있을 것 같아."
Tony,"그래. 어쨌든... 저 문 뒤에 50명 정도의 기자들이 있어. 진짜 기자들이야, 블로거가 아니라."
Tony,준비되면... 이걸 입어볼래? 그리고 난 세상에 어벤저스의 최신 공식 멤버를 소개할 거야: 스파이더맨.
Tony,그래. 한번 봐봐.
Tony,"그래서, 기자회견 후에 해피가 네 방, 새 숙소로 안내해 줄 거야. 그는 어디 사이에 있지? 비전 옆이야?"
Tony,재밌을 거야.
Tony,넌 잘 어울릴 거야.
Tony,괜찮아? 괜찮다고? 어떻게 괜찮을 수가 있어?
Tony,"날 거절하는 거야? 잘 생각해 봐. 저길 봐. 날 봐. 마지막 기회야, 예 아니면 아니오?"
Tony,"좋아. 그건 좀 스프링스틴 같은, 내가 좋아하는 노동자 영웅 분위기네. 음, 해피가 널 집에 데려다 줄 거야. 그래?"
Tony,"그래, 파커 군. 아주 좋아."
Tony,좋아.
Tony,"그래, 넌 통과했어. 좋아, 어린 사슴아, 이제 가봐."
Tony,"그래, 고마워."
Tony,있잖아? 그 꼬마가 정말 성숙한 선택을 했어. 우리를 완전히 놀라게 했지.
Tony,그는 꼬마에게 차에서 기다리라고 했어.
Tony,"뭔가 생각해 봐. 음... 해피, 그 반지 아직 갖고 있어?"
Tony,약혼 반지?
Tony,알겠어.
Tony,"글쎄, 그게 우리에게 시간을 좀 벌어줄 수 있겠지."
Tony,마치 우리에게 시간이 필요한 것처럼 말이야.
Tony,"내가 문 열어줄까, 자기?"
Tony,"천천히, 천천히. 난 전혀 농담하는 게 아니야."
Tony,아니야.
Tony,"있잖아, 꿈에서 소변을 봐야 하는 상황 알지?"
Tony,"그래, 그리고 넌 '오 세상에, 화장실이 없어, 어떡하지?' '아! 누가 보고 있어.' '바지에 싸버릴 거야.' 이러는 거지."
Tony,그래.
Tony,"맞아! 그게 내가 말하려는 요점이야. 그것과 관련해서, 어젯밤에 꿈을 꿨는데, 우리에게 아이가 있었어. 너무 생생했어. 네 괴짜 삼촌 이름을 따서 지었지. 어, 이름이 뭐였더라?"
Tony,모건! 모건이야.
Tony,기대 중.
Tony,그래?
Tony,꿈을 꿨어. 너무 생생했어.
Tony,네가 이 얘기를 꺼내서 다행이야. 별거 아니거든. 그냥 나노 입자용 하우징 유닛일 뿐이야.
Tony,"아니, 아니, 이건 부착물이야, 그런 게 아-"
Tony,"알아. 수술했잖아. 난 그저 우리를 보호하려는 거야. 미래의 우리 말이야, 그게 전부야. 옷장에 괴물이 있을 경우를 대비해서, 알지..."
Tony,날 정말 잘 아는구나. 내 말을 다 끝내버리네.
Tony,그래. 뭐가 있어야 하는지 알아? 더 이상의 놀라운 일은 없어야 해. 오늘 밤 멋진 저녁 식사를 할 거야. 이 해리 윈스턴을 자랑하면서 말이야. 맞지? 그리고 더 이상 놀라운 일은 없어야 해. 절대로. 약속해야겠어.
Tony,그럴게.
Tony,"미안한데, 티켓이라도 나눠주는 거야?"
Tony,그리고 '우리'가 누구야?
Tony,브루스.
Tony,괜찮아?
Tony,지금까지 꿈꾸지 못한'이라고 진지하게 말한 거야?
Tony,이게 그런 거야...?
Tony,"그렇게 하도록 하지. 타노스가 여섯 개 다 필요하다면, 이걸 그냥 쓰레기 분쇄기에 넣어버리면 어때?"
Tony,"난 유제품을 끊었지만, 벤앤제리스가 내 이름을 딴 맛을 만들어서..."
Tony,나쁘지 않아.
Tony,뭐든지. 요점은: 상황이 변한다는 거야.
Tony,"그리고 반대로, 그게 우리에게 대항할 수 있는 그의 가장 좋은 기회일 수도 있어."
Tony,풍선 동물 만드는 것 말고 네 직업이 정확히 뭐야?
Tony,"그래, 그게 문제야."
Tony,2주 전에 비전이 트랜스폰더를 껐어. 오프라인 상태야.
Tony,난 그를 잃은 게 아니야. 그는 그 이상이야. 진화하고 있어.
Tony,젠장. 아마도 스티브 로저스겠지.
Tony,아마도. 하지만...
Tony,"그렇게 쉽지 않아. 세상에, 우리 한동안 연락 안 했지?"
Tony,어벤저스는 해체됐어. 우린 끝장났어.
Tony,캡과 난 심하게 다퉜어. 지금은 말도 안 해.
Tony,"저기, 닥터, 혹시 머리카락 움직이고 있는 거 아니지?"
Tony,괜찮아?
Tony,"그를 도와! 웡, 닥터."
Tony,"프라이데이, 내가 보고 있는 게 뭐지?"
Tony,"이봐! 그 타임 스톤을 뒷주머니에 넣는 게 좋을 거야, 닥터!"
Tony,"프라이데이, 43번가 남쪽의 모든 사람들을 대피시켜, 응급 구조대에 알려."
Tony,"미안하지만, 오늘 지구는 문 닫았어. 짐 싸서 여기서 나가는 게 좋을 거야."
Tony,"꺼져버리라는 뜻이야, 스퀴드워드!"
Tony,"배너, 한 조각 할래?"
Tony,맞아.
Tony,"오랜만이군. 돌아와서 좋다, 친구."
Tony,네 녀석은 어디 있어?
Tony,그런 거 할 시간 없어.
Tony,저기 그게 있잖아. 가자.
Tony,"[스트레인지를 흘긋 보며] 이봐, 마법사들 앞에서 날 창피하게 하고 있어."
Tony,"괜찮아. 이봐, 물러서. 그를 지켜봐. 고마워."
Tony,나노 기술이야. 마음에 들어? 약간-
Tony,그 돌을 당장 여기서 빼내야 해.
Tony,정확해. 안녕.
Tony,"정말, 정말 좋아. 아주 좋아. 도울 계획 있어?"
Tony,망치.
Tony,"꼬마야, 어디서 왔어?"
Tony,그는 우주에서 왔어. 마법사한테서 목걸이를 훔치러 왔지.
Tony,"꼬마야, 저게 마법사야. 잡아."
Tony,"꼬마야, 매달려. F.R.I.D.A.Y., 힘 좀 줘. 17-A 잠금 해제. 피터, 놓아야 해. 내가 잡을게."
Tony,너무 높아. 공기가 부족해질 거야.
Tony,"즐거운 여행해, 꼬마야. F.R.I.D.A.Y., 걔 집으로 보내."
Tony,"그래, 난 괜찮아. 그냥 8시 30분 예약을 미뤄야 할 것 같아."
Tony,그냥... 아마 한동안 돌아오지 못할 것 같아서.
Tony,그래.
Tony,"자기야, 미안해. 정말 미안해, 뭐라고 해야 할지 모르겠어."
Tony,페퍼...
Tony,뭐야-
Tony,넌 여기 있으면 안 돼.
Tony,듣고 싶지 않아.
Tony,이제 들어야겠네.
Tony,방금 뭐라고 했어?
Tony,그래. 내가 네가 있길 원치 않는 바로 그곳이지. 여긴 코니 아일랜드가 아니야. 소풍도 아니고. 편도 티켓이라고. 알겠어? 이걸 생각해봤다고 하지 마. 넌 이걸 제대로 생각해볼 수가 없었을 거야.
Tony,넌 이걸 제대로 생각해볼 수가 없었을 거야.
Tony,"자, 상황이 있어. 저기 아래 보이지? 그가 위험해. 네 계획은 뭐야? 가."
Tony,"말해줘야겠는데, 그는 내 친구가 아니야. 그의 목숨을 구하는 건 그저 직업적 예의일 뿐이야."
Tony,"그래, 하지만 꼬마가 영화를 더 많이 봤잖아."
Tony,그래. 이제 그가 도망가고 싶어 하네. 멋진 계획이야.
Tony,그리고 난 네가 날 고마워하길 바라. 어서. 듣고 있어.
Tony,누가 방금 네 마법 엉덩이를 구했지? 나야.
Tony,"인정해. 내가 말했을 때 빠졌어야 했어. 난 널 빼려고 했고, 넌 거절했지."
Tony,"그 사실 때문에, 우리는 지금 지구에서 수십억 마일 떨어진 날아다니는 도넛 안에 있고 백업도 없어."
Tony,아니. 넌 밀항자야. 어른들이 얘기하고 있어.
Tony,이 우주선은 스스로 경로를 수정하고 있어. 자동조종 중이야.
Tony,그래.
Tony,"그래, 들었어. 생각 중이야... 우리가 그래선 안 될 것 같아."
Tony,"아니. 이해 못하는 건 너야. 타노스는 6년 동안 내 머릿속에 있었어... 뉴욕에 군대를 보냈을 때부터 지금 그가 돌아왔을 때까지! 그리고 난 어떻게 해야 할지 모르겠어. 그래서 우리 영역에서 싸우는 게 나은지 그의 영역에서 싸우는 게 나은지 확신이 안 서. 하지만 넌 그들이 한 일을, 그가 할 수 있는 일을 봤잖아. 적어도 그의 영역에서는 그가 예상하지 못할 거야. 그래서 난 그에게 싸움을 걸자고 해. 닥터, 동의하시나요?"
Tony,"좋아. 좋아. 도덕적 나침반이군. 우린 똑바로 가고 있어. 좋아, 꼬마. 넌 이제 어벤저스야."
Tony,우리가 도착한 것 같아. 이 장치엔 자동 주차 기능이 없는 것 같아. 손을 이 조종 장치에 넣어. 그걸 손으로 감싸. 알겠어?
Tony,"이건 큰 녀석 하나를 위한 거라서, 우리가 동시에 움직여야 해."
Tony,우리 돌아야 할 것 같아.
Tony,괜찮아?
Tony,아슬아슬했어. 이번엔 내가 빚졌네.
Tony,이 여행 동안 더 이상 대중문화 얘기 한마디도 듣고 싶지 않아. 알겠어?
Tony,"그래, 더 좋은 질문을 해줄게. 가모라가 누구야?"
Tony,"그래, 해보자고! 네가 내 녀석을 쏘면, 난 그를 날려버릴 거야. 가자!"
Tony,넌 지구 출신이야?
Tony,"그래, 그건 지구에 있어, 바보야. 우릴 왜 귀찮게 하는 거야?"
Tony,토르를 알아?
Tony,그는 지금 어디 있지?
Tony,"그래, 우리한테 한 가지 이점이 있어. 그가 우리한테 오고 있어. 그걸 이용하자. 좋아, 계획이 있어. 아니면 적어도 계획의 시작이라도. 꽤 간단해. 그를 유인해서, 제압하고, 우리가 필요한 걸 얻는 거야. 절대 이 녀석이랑 춤추고 싶진 않아. 우린 그저 건틀렛만 있으면 돼."
Tony,하품하고 있어? 내가 설명하는 중에? 응? 내가 한 말 들었어?
Tony,"좋아, 미스터 클린은 자기 세계에 빠져있군."
Tony,"좋아, 그냥 저기로 가. 로드 씨, 당신 사람들 모이게 할 수 있어요?"
Tony,우리가 뭉쳐야 해. 우리가 그에게 맞설 수 있는 게 기운찬 태도뿐이라면...
Tony,무슨 댄스 대결?
Tony,"이런 거 부추기지 마, 알겠어?"
Tony,플래시 고든한테서는 도움을 못 받겠군.
Tony,네 수학 실력에 정신이 아찔해지는군.
Tony,"스트레인지, 우리 괜찮아?"
Tony,돌아왔구나. 괜찮아. 안녕.
Tony,우리가 이긴 경우는 몇 번이야?
Tony,"그래, 이게 바로 그거야. 모든 게 여기로 이어졌어."
Tony,"진정해, 퀼."
Tony,넌 괜찮아.
Tony,"그럴 필요 없어. 왜냐하면 어... 넌 그저 자리를 지키고 있을 뿐이니까. 오, 그래, 아슬아슬했어. 그게 골이야. 이제 우리 1대1이네."
Tony,우린 동점이야. 긴장감 느껴져? 재밌지.
Tony,그건 최악이었어. 이제 이길 기회가 있어.
Tony,그리고... 넌 이겼어. 축하해.
Tony,공정한 게임이었어. 좋은 스포츠맨십이야. 재밌었어?
